{"boundaries": [], "components": [{"id": "ceo", "label": "CEO", "sublabel": "chief executive", "type": "backend"}, {"id": "vp_eng", "label": "VP Engineering", "sublabel": "engineering", "type": "backend"}, {"id": "vp_sales", "label": "VP Sales", "sublabel": "sales", "type": "backend"}, {"id": "mgr_be", "label": "Mgr Backend", "sublabel": "backend team", "type": "backend"}, {"id": "mgr_fe", "label": "Mgr Frontend", "sublabel": "frontend team", "type": "backend"}, {"id": "mgr_ent", "label": "Mgr Enterprise", "sublabel": "enterprise sales", "type": "backend"}, {"id": "mgr_smb", "label": "Mgr SMB", "sublabel": "smb sales", "type": "backend"}, {"id": "ic_be", "label": "IC Backend", "sublabel": "backend engineer", "type": "backend"}], "connections": [{"from": "ceo", "id": "o01", "to": "vp_eng", "variant": "emphasis"}, {"from": "ceo", "id": "o02", "to": "vp_sales", "variant": "emphasis"}, {"from": "vp_eng", "id": "o03", "to": "mgr_be", "variant": "emphasis"}, {"from": "vp_eng", "id": "o04", "to": "mgr_fe", "variant": "emphasis"}, {"from": "vp_sales", "id": "o05", "to": "mgr_ent", "variant": "emphasis"}, {"from": "vp_sales", "id": "o06", "to": "mgr_smb", "variant": "emphasis"}, {"from": "mgr_be", "id": "o07", "to": "ic_be", "variant": "emphasis"}], "diagram_type": "architecture", "meta": {"legend": {"entries": {"backend": {"label": "Role"}}}, "quality_profile": "showcase", "subtitle": "plain tree, 8 nodes, 7 edges, no frames", "title": "org chart — plain tree (SYS-003 O3 proof)", "visual_preset": "apple-hig"}, "schema_version": 1}